{
  "$schema": "https://json-schema.org/draft/2020-12/schema",
  "$id": "urn:aibridge:contracts:v1:role",
  "title": "RoleTemplate",
  "description": "@generated by scripts/generate-contracts.ts from src/orchestration/schemas.ts:422 (export roleTemplateSchema). DO NOT EDIT. Invariants from .refine()/.superRefine() are NOT representable in JSON Schema and are absent from this file; they remain enforced by the TypeScript engine, which is the sole authority for them (ADR 0008 §2.2 Tier 2).",
  "type": "object",
  "properties": {
    "schemaVersion": {
      "anyOf": [
        {
          "type": "number",
          "const": 1,
          "title": "RoleTemplateSchemaVersion0"
        },
        {
          "type": "number",
          "const": 2,
          "title": "RoleTemplateSchemaVersion1"
        }
      ]
    },
    "roleId": {
      "type": "string",
      "pattern": "^[A-Za-z0-9][A-Za-z0-9._:-]{0,127}$",
      "title": "RoleTemplateRoleId"
    },
    "templateVersion": {
      "type": "integer",
      "exclusiveMinimum": 0,
      "maximum": 9007199254740991,
      "title": "RoleTemplateTemplateVersion"
    },
    "projectId": {
      "type": "string",
      "pattern": "^[A-Za-z0-9][A-Za-z0-9._:-]{0,127}$",
      "title": "RoleTemplateProjectId"
    },
    "name": {
      "type": "string",
      "minLength": 1,
      "maxLength": 256,
      "title": "RoleTemplateName"
    },
    "purpose": {
      "type": "string",
      "minLength": 1,
      "maxLength": 4096,
      "title": "RoleTemplatePurpose"
    },
    "instructions": {
      "type": "string",
      "minLength": 1,
      "maxLength": 65536,
      "title": "RoleTemplateInstructions"
    },
    "requiredCapabilities": {
      "maxItems": 128,
      "type": "array",
      "items": {
        "type": "string",
        "pattern": "^[A-Za-z0-9][A-Za-z0-9._:-]{0,127}$",
        "title": "RoleTemplateRequiredCapabilities"
      },
      "title": "RoleTemplateRequiredCapabilities"
    },
    "preferredRuntimeKinds": {
      "maxItems": 128,
      "type": "array",
      "items": {
        "type": "string",
        "pattern": "^[A-Za-z0-9][A-Za-z0-9._:-]{0,127}$",
        "title": "RoleTemplatePreferredRuntimeKinds"
      },
      "title": "RoleTemplatePreferredRuntimeKinds"
    },
    "contextSelectionPolicyReference": {
      "type": "object",
      "properties": {
        "namespace": {
          "type": "string",
          "minLength": 1,
          "maxLength": 256,
          "title": "RoleTemplateContextSelectionPolicyReferenceNamespace"
        },
        "id": {
          "type": "string",
          "minLength": 1,
          "maxLength": 4096,
          "title": "RoleTemplateContextSelectionPolicyReferenceId"
        }
      },
      "required": [
        "namespace",
        "id"
      ],
      "additionalProperties": false
    },
    "permissionRestrictions": {
      "type": "object",
      "properties": {
        "allowedCapabilities": {
          "maxItems": 128,
          "type": "array",
          "items": {
            "type": "string",
            "pattern": "^[A-Za-z0-9][A-Za-z0-9._:-]{0,127}$",
            "title": "RoleTemplatePermissionRestrictionsAllowedCapabilities"
          },
          "title": "RoleTemplatePermissionRestrictionsAllowedCapabilities"
        },
        "deniedCapabilities": {
          "maxItems": 128,
          "type": "array",
          "items": {
            "type": "string",
            "pattern": "^[A-Za-z0-9][A-Za-z0-9._:-]{0,127}$",
            "title": "RoleTemplatePermissionRestrictionsDeniedCapabilities"
          },
          "title": "RoleTemplatePermissionRestrictionsDeniedCapabilities"
        },
        "approvalRequirements": {
          "type": "object",
          "properties": {
            "destructiveEffects": {
              "type": "boolean"
            },
            "externalEffects": {
              "type": "boolean"
            },
            "capabilities": {
              "maxItems": 128,
              "type": "array",
              "items": {
                "type": "string",
                "pattern": "^[A-Za-z0-9][A-Za-z0-9._:-]{0,127}$",
                "title": "RoleTemplatePermissionRestrictionsApprovalRequirementsCapabilities"
              },
              "title": "RoleTemplatePermissionRestrictionsApprovalRequirementsCapabilities"
            }
          },
          "required": [
            "destructiveEffects",
            "externalEffects",
            "capabilities"
          ],
          "additionalProperties": false
        },
        "compositionMode": {
          "type": "string",
          "enum": [
            "intersection",
            "union"
          ],
          "title": "RoleTemplatePermissionRestrictionsCompositionMode"
        }
      },
      "required": [
        "allowedCapabilities",
        "deniedCapabilities",
        "approvalRequirements"
      ],
      "additionalProperties": false
    },
    "author": {
      "oneOf": [
        {
          "type": "object",
          "properties": {
            "kind": {
              "type": "string",
              "const": "user",
              "title": "RoleTemplateAuthor0Kind"
            },
            "userId": {
              "type": "string",
              "pattern": "^[A-Za-z0-9][A-Za-z0-9._:-]{0,127}$",
              "title": "RoleTemplateAuthor0UserId"
            }
          },
          "required": [
            "kind",
            "userId"
          ],
          "additionalProperties": false,
          "title": "RoleTemplateAuthor0"
        },
        {
          "type": "object",
          "properties": {
            "kind": {
              "type": "string",
              "const": "node",
              "title": "RoleTemplateAuthor1Kind"
            },
            "nodeId": {
              "type": "string",
              "pattern": "^[A-Za-z0-9][A-Za-z0-9._:-]{0,127}$",
              "title": "RoleTemplateAuthor1NodeId"
            }
          },
          "required": [
            "kind",
            "nodeId"
          ],
          "additionalProperties": false,
          "title": "RoleTemplateAuthor1"
        },
        {
          "type": "object",
          "properties": {
            "kind": {
              "type": "string",
              "const": "session",
              "title": "RoleTemplateAuthor2Kind"
            },
            "sessionId": {
              "type": "string",
              "pattern": "^[A-Za-z0-9][A-Za-z0-9._:-]{0,127}$",
              "title": "RoleTemplateAuthor2SessionId"
            }
          },
          "required": [
            "kind",
            "sessionId"
          ],
          "additionalProperties": false,
          "title": "RoleTemplateAuthor2"
        },
        {
          "type": "object",
          "properties": {
            "kind": {
              "type": "string",
              "const": "system",
              "title": "RoleTemplateAuthor3Kind"
            },
            "name": {
              "type": "string",
              "minLength": 1,
              "maxLength": 256,
              "title": "RoleTemplateAuthor3Name"
            }
          },
          "required": [
            "kind",
            "name"
          ],
          "additionalProperties": false,
          "title": "RoleTemplateAuthor3"
        }
      ]
    },
    "createdAt": {
      "type": "string",
      "pattern": "^\\d{4}-\\d{2}-\\d{2}T\\d{2}:\\d{2}:\\d{2}(?:\\.\\d{1,9})?Z$",
      "title": "RoleTemplateCreatedAt"
    }
  },
  "required": [
    "schemaVersion",
    "roleId",
    "templateVersion",
    "projectId",
    "name",
    "purpose",
    "instructions",
    "requiredCapabilities",
    "preferredRuntimeKinds",
    "contextSelectionPolicyReference",
    "permissionRestrictions",
    "author",
    "createdAt"
  ],
  "additionalProperties": false
}
